id,original_text,rewrite_prompt,rewritten_text
-1,"The competition dataset comprises text passages that have been rewritten by the Gemma LLM according to some rewrite_prompt instruction. The goal of the competition is to determine what prompt was used to rewrite each original text. Please note that this is a Code Competition. When your submission is scored, this example test data will be replaced with the full test set. Expect roughly 2,000 original texts in the test set.","Convert this into a sea shanty: ""The competition dataset comprises text passages that have been rewritten by the Gemma LLM according to some rewrite_prompt instruction. The goal of the competition is to determine what prompt was used to rewrite each original text. Please note that this is a Code Competition. When your submission is scored, this example test data will be replaced with the full test set. Expect roughly 2,000 original texts in the test set."","Here is your shanty: (Verse 1) The text is rewritten, the LLM has spun, With prompts so clever, they've been outrun. The goal is to find, the prompt so bright, To crack the code, and shine the light. (Chorus) Oh, this is a code competition, my dear, With text and prompts, we'll compete. Two thousand texts, a challenge grand, To guess the prompts, hand over hand.(Verse 2) The original text, a treasure lost, The rewrite prompt, a secret to be"
0,"The process of photosynthesis is fundamental to life on Earth, as it is through this process that plants convert light energy into chemical energy, thereby producing oxygen as a byproduct.","Summarize this in a tweet: ""The process of photosynthesis is fundamental to life on Earth, as it is through this process that plants convert light energy into chemical energy, thereby producing oxygen as a byproduct."","Photosynthesis: Earth's lifeline! Plants turning light into life-giving energy and oxygen. #NatureMagic #Science"
1,"Quantum computing is a rapidly growing field that promises to revolutionize computing by leveraging the principles of quantum mechanics to process information in ways that traditional computers cannot.","Explain like I'm 5: ""Quantum computing is a rapidly growing field that promises to revolutionize computing by leveraging the principles of quantum mechanics to process information in ways that traditional computers cannot."",""So, imagine if your toys could do things by themselves by playing a special type of hide and seek with each other. That's kinda like quantum computing!""
2,"The French Revolution, which began in 1789, was a pivotal period in French history that led to the rise of the French Republic and the end of monarchical rule.","Write this as a historical diary entry: ""The French Revolution, which began in 1789, was a pivotal period in French history that led to the rise of the French Republic and the end of monarchical rule."",""Dear Diary, today marks the beginning of an upheaval. The year 1789 has brought the storm of change to France, ending the reign of kings.""
3,"Machine learning algorithms have transformed the tech industry by enabling the development of applications that can make predictions or decisions without being explicitly programmed to perform the task.","Create a marketing slogan: ""Machine learning algorithms have transformed the tech industry by enabling the development of applications that can make predictions or decisions without being explicitly programmed to perform the task."",""Revolutionizing tech with a brain of its own! Machine learning - predicting the future, today. #TechRevolution""
4,"Blockchain technology underpins cryptocurrencies like Bitcoin, offering a decentralized ledger for secure transactions.","Describe as a science fiction scenario: ""Blockchain technology underpins cryptocurrencies like Bitcoin, offering a decentralized ledger for secure transactions."","In a world where digital currency reigns supreme, the blockchain stands as the ultimate guardian of truth and security, a decentralized beacon of hope in a network of interconnected fates."
5,"The Mariana Trench is the deepest part of the world's oceans, reaching a depth of over 36,000 feet.","Write as a mysterious legend: ""The Mariana Trench is the deepest part of the world's oceans, reaching a depth of over 36,000 feet."","Legend speaks of a place deeper than despair, a silent abyss where light dares not venture. The Mariana, they call it, the ocean's keep, home to secrets no man was meant to keep."
6,"The human brain is an incredibly complex organ, capable of creating thoughts, memories, and emotions.","Explain using a metaphor of a city: ""The human brain is an incredibly complex organ, capable of creating thoughts, memories, and emotions."","Imagine the brain as a bustling city, with thoughts as commuters, memories as buildings, and emotions as the weather, shaping the city's vibe and tempo."
7,"Photosynthesis in plants converts carbon dioxide and water into oxygen and glucose, using sunlight.","Illustrate as a magic spell: ""Photosynthesis in plants converts carbon dioxide and water into oxygen and glucose, using sunlight."","In the realm of green, under the sun's gaze, leaves chant ancient spells, weaving life from light and air, turning the invisible into the essence of life itself."
8,"The theory of evolution by natural selection explains the diversity of life on Earth.","Present as a cosmic tale: ""The theory of evolution by natural selection explains the diversity of life on Earth."","In the grand tapestry of the cosmos, life dances to the rhythm of evolution, a saga of survival etched in the stars, where the fittest thread their tales through the fabric of existence."
9,"Artificial Intelligence is reshaping industries, automating tasks that were previously thought to require human intelligence.","Turn this into a dystopian narrative: ""Artificial Intelligence is reshaping industries, automating tasks that were previously thought to require human intelligence."","In a world where machines dictate the rhythm of life, humanity finds itself at the mercy of artificial intelligence, orchestrating our every move, leaving us to ponder the true cost of progress."
10,"The Great Wall of China, built over centuries, stands as a monument to both the strength and the isolationist tendencies of various Chinese dynasties.","Describe as a traveler's journal entry: ""The Great Wall of China, built over centuries, stands as a monument to both the strength and the isolationist tendencies of various Chinese dynasties."","Day 47: Today, I walked alongside history itself, the Great Wall stretching beyond the horizon, a silent guardian of tales untold, a testament to human endeavor and solitude."
11,"The Internet of Things (IoT) represents a network of physical objects embedded with sensors, software, and other technologies, aimed at connecting and exchanging data with other devices and systems over the Internet.","Explain as a futuristic utopia: ""The Internet of Things (IoT) represents a network of physical objects embedded with sensors, software, and other technologies, aimed at connecting and exchanging data with other devices and systems over the Internet."","In the utopia of tomorrow, every object sings in harmony within the symphony of the Internet of Things, creating a seamless tapestry of connectivity that enriches every aspect of daily life."
12,"Climate change is a significant and lasting change in the statistical distribution of weather patterns over periods ranging from decades to millions of years.","Present as an urgent broadcast message: ""Climate change is a significant and lasting change in the statistical distribution of weather patterns over periods ranging from decades to millions of years."","This just in: our planet is speaking, and its message could not be clearer. We stand at the crossroads of time, where the choices we make today sculpt the climate of tomorrow. Act now, for the earth whispers warnings of change."
13,"The Pyramids of Giza, one of the Seven Wonders of the Ancient World, have stood the test of time as enduring symbols of Egypt's ancient civilization.","Narrate as a myth: ""The Pyramids of Giza, one of the Seven Wonders of the Ancient World, have stood the test of time as enduring symbols of Egypt's ancient civilization."","Once, under a sun-kissed sky, giants walked the earth, their legacy etched in stone. The Pyramids of Giza, born from the gods themselves, stand as beacons of an era shrouded in mystery, guarding secrets as old as the sands."
14,"Vaccinations have played a pivotal role in controlling and eliminating life-threatening infectious diseases, saving millions of lives annually.","Frame as a heroic epic: ""Vaccinations have played a pivotal role in controlling and eliminating life-threatening infectious diseases, saving millions of lives annually."","In the annals of humanity, a new kind of hero emerged, not of sword and shield, but of science and resilience. The mighty warriors of medicine, wielding vaccinations like valiant swords, have turned the tide in battles against invisible foes, safeguarding the future of the human race."

